{
  "version": "1.1.0",
  "codename": "Basic Integration",
  "release_date": "2025-01-27",
  "functional_components": [
    "intelligent-driver-generator.js",
    "legacy-driver-converter.js",
    "driver-research-automation.js",
    "silent-reference-processor.js",
    "comprehensive-silent-processor.js",
    "additive-silent-integrator.js"
  ],
  "features": [
    "Basic driver generation",
    "Legacy driver conversion",
    "Silent integration",
    "Additive processing",
    "Research automation",
    "Reference processing"
  ],
  "drivers": {
    "intelligent": 0,
    "existing": 148,
    "total": 148
  },
  "workflows": 6,
  "tools": 6,
  "verification": {
    "version": "1.1.0",
    "codename": "Basic Integration",
    "release_date": "2025-01-27",
    "components_verified": [
      "intelligent-driver-generator.js",
      "legacy-driver-converter.js",
      "driver-research-automation.js",
      "silent-reference-processor.js",
      "comprehensive-silent-processor.js",
      "additive-silent-integrator.js"
    ],
    "features_verified": [
      "Basic driver generation",
      "Legacy driver conversion",
      "Silent integration",
      "Additive processing",
      "Research automation",
      "Reference processing"
    ],
    "functionality_score": 100,
    "total_components": 6,
    "total_features": 6,
    "status": "fully_functional"
  },
  "release_notes": "# Release Notes - Version 1.1.0 (Basic Integration)\n\n## üìã **Vue d'ensemble**\n- **Version**: 1.1.0\n- **Nom de code**: Basic Integration\n- **Date de release**: 2025-01-27\n- **Statut**: Release fonctionnelle compl√®te\n\n## üöÄ **Fonctionnalit√©s Principales**\n- Basic driver generation\n- Legacy driver conversion\n- Silent integration\n- Additive processing\n- Research automation\n- Reference processing\n\n## üîß **Composants Fonctionnels**\n- intelligent-driver-generator.js\n- legacy-driver-converter.js\n- driver-research-automation.js\n- silent-reference-processor.js\n- comprehensive-silent-processor.js\n- additive-silent-integrator.js\n\n## üìä **M√©triques**\n- **Drivers intelligents**: 0\n- **Drivers existants**: 148\n- **Total drivers**: 148\n- **Workflows GitHub Actions**: 6\n- **Outils intelligents**: 6\n\n## üéØ **Am√©liorations**\n- Syst√®me de gestion des versions fonctionnelles\n- V√©rification automatique de la fonctionnalit√©\n- Release notes d√©taill√©es\n- Guides d'installation complets\n- Proc√©dures de test automatis√©es\n\n## üîÑ **Migration**\n- Compatible avec les versions pr√©c√©dentes\n- Migration automatique des donn√©es\n- Pr√©servation des configurations existantes\n- Mise √† jour progressive des fonctionnalit√©s\n\n## üìà **Performance**\n- Optimisation des performances\n- R√©duction de la latence\n- Am√©lioration de la stabilit√©\n- Gestion efficace de la m√©moire\n\n## üõ°Ô∏è **S√©curit√©**\n- Validation des entr√©es\n- Gestion s√©curis√©e des donn√©es\n- Protection contre les vuln√©rabilit√©s\n- Audit de s√©curit√© automatis√©\n\n## üìö **Documentation**\n- Documentation compl√®te\n- Guides d'utilisation\n- Exemples de code\n- Tutoriels vid√©o\n\n## üß™ **Tests**\n- Tests unitaires complets\n- Tests d'int√©gration\n- Tests de performance\n- Tests de s√©curit√©\n\n## üîß **Installation**\nVoir le guide d'installation pour les instructions d√©taill√©es.\n\n## üêõ **Corrections de Bugs**\n- Correction des probl√®mes de compatibilit√©\n- Am√©lioration de la stabilit√©\n- Optimisation des performances\n- Correction des erreurs de validation\n\n## üöÄ **Nouvelles Fonctionnalit√©s**\n- Basic driver generation\n- Legacy driver conversion\n- Silent integration\n- Additive processing\n- Research automation\n- Reference processing\n\n## üìã **Prochaines √âtapes**\n- Am√©lioration continue des fonctionnalit√©s\n- Ajout de nouvelles capacit√©s\n- Optimisation des performances\n- Extension de la compatibilit√©\n\n---\n**Release g√©n√©r√©e automatiquement par le Version Functional Release Manager**\n",
  "installation_guide": "# Guide d'Installation - Version 1.1.0 (Basic Integration)\n\n## üìã **Pr√©requis**\n- Node.js 18 ou sup√©rieur\n- Git\n- Acc√®s au repository GitHub\n- Permissions d'√©criture sur le syst√®me\n\n## üöÄ **Installation Rapide**\n\n### 1. Cloner le Repository\n```bash\ngit clone https://github.com/dlnraja/tuya_repair.git\ncd tuya_repair\n```\n\n### 2. Installer les D√©pendances\n```bash\nnpm install\n```\n\n### 3. V√©rifier la Version\n```bash\nnode tools/version-functional-release.js --check-version 1.1.0\n```\n\n### 4. Tester la Fonctionnalit√©\n```bash\nnode tools/version-functional-release.js --test-functionality 1.1.0\n```\n\n## üîß **Installation D√©taill√©e**\n\n### Composants Fonctionnels\n\n#### intelligent-driver-generator.js\n```bash\n# V√©rifier l'existence\nls -la tools/intelligent-driver-generator.js\n\n# Tester la fonctionnalit√©\nnode tools/intelligent-driver-generator.js --test\n```\n\n\n#### legacy-driver-converter.js\n```bash\n# V√©rifier l'existence\nls -la tools/legacy-driver-converter.js\n\n# Tester la fonctionnalit√©\nnode tools/legacy-driver-converter.js --test\n```\n\n\n#### driver-research-automation.js\n```bash\n# V√©rifier l'existence\nls -la tools/driver-research-automation.js\n\n# Tester la fonctionnalit√©\nnode tools/driver-research-automation.js --test\n```\n\n\n#### silent-reference-processor.js\n```bash\n# V√©rifier l'existence\nls -la tools/silent-reference-processor.js\n\n# Tester la fonctionnalit√©\nnode tools/silent-reference-processor.js --test\n```\n\n\n#### comprehensive-silent-processor.js\n```bash\n# V√©rifier l'existence\nls -la tools/comprehensive-silent-processor.js\n\n# Tester la fonctionnalit√©\nnode tools/comprehensive-silent-processor.js --test\n```\n\n\n#### additive-silent-integrator.js\n```bash\n# V√©rifier l'existence\nls -la tools/additive-silent-integrator.js\n\n# Tester la fonctionnalit√©\nnode tools/additive-silent-integrator.js --test\n```\n\n\n### Workflows GitHub Actions\n\n#### Workflow 1\n```yaml\n# V√©rifier la configuration\ncat .github/workflows/workflow-1.yml\n\n# Tester le workflow\ngh workflow run workflow-1\n```\n\n\n#### Workflow 2\n```yaml\n# V√©rifier la configuration\ncat .github/workflows/workflow-2.yml\n\n# Tester le workflow\ngh workflow run workflow-2\n```\n\n\n#### Workflow 3\n```yaml\n# V√©rifier la configuration\ncat .github/workflows/workflow-3.yml\n\n# Tester le workflow\ngh workflow run workflow-3\n```\n\n\n#### Workflow 4\n```yaml\n# V√©rifier la configuration\ncat .github/workflows/workflow-4.yml\n\n# Tester le workflow\ngh workflow run workflow-4\n```\n\n\n#### Workflow 5\n```yaml\n# V√©rifier la configuration\ncat .github/workflows/workflow-5.yml\n\n# Tester le workflow\ngh workflow run workflow-5\n```\n\n\n#### Workflow 6\n```yaml\n# V√©rifier la configuration\ncat .github/workflows/workflow-6.yml\n\n# Tester le workflow\ngh workflow run workflow-6\n```\n\n\n## üß™ **Tests de Validation**\n\n### Test de Fonctionnalit√©\n```bash\nnode tools/version-functional-release.js --verify 1.1.0\n```\n\n### Test de Performance\n```bash\nnode tools/version-functional-release.js --benchmark 1.1.0\n```\n\n### Test de Compatibilit√©\n```bash\nnode tools/version-functional-release.js --compatibility 1.1.0\n```\n\n## üîÑ **Migration depuis les Versions Pr√©c√©dentes**\n\n### Migration depuis 1.2.0\n```bash\n# Sauvegarder les donn√©es existantes\ncp -r drivers drivers_backup_1.2.0\n\n# Mettre √† jour vers 1.3.0\ngit pull origin master\nnpm install\n\n# V√©rifier la migration\nnode tools/version-functional-release.js --migrate 1.2.0 1.3.0\n```\n\n### Migration depuis 1.1.0\n```bash\n# Sauvegarder les donn√©es existantes\ncp -r drivers drivers_backup_1.1.0\n\n# Mettre √† jour vers 1.3.0\ngit pull origin master\nnpm install\n\n# V√©rifier la migration\nnode tools/version-functional-release.js --migrate 1.1.0 1.3.0\n```\n\n## üõ†Ô∏è **Configuration**\n\n### Configuration de Base\n```javascript\n// config/version-1.1.0.json\n{\n  \"version\": \"1.1.0\",\n  \"codename\": \"Basic Integration\",\n  \"release_date\": \"2025-01-27\",\n  \"functional_components\": [\n  \"intelligent-driver-generator.js\",\n  \"legacy-driver-converter.js\",\n  \"driver-research-automation.js\",\n  \"silent-reference-processor.js\",\n  \"comprehensive-silent-processor.js\",\n  \"additive-silent-integrator.js\"\n],\n  \"features\": [\n  \"Basic driver generation\",\n  \"Legacy driver conversion\",\n  \"Silent integration\",\n  \"Additive processing\",\n  \"Research automation\",\n  \"Reference processing\"\n]\n}\n```\n\n### Configuration Avanc√©e\n```javascript\n// config/advanced-1.1.0.json\n{\n  \"performance\": {\n    \"optimization\": true,\n    \"caching\": true,\n    \"compression\": true\n  },\n  \"security\": {\n    \"validation\": true,\n    \"encryption\": true,\n    \"audit\": true\n  },\n  \"monitoring\": {\n    \"logs\": true,\n    \"metrics\": true,\n    \"alerts\": true\n  }\n}\n```\n\n## üìä **Validation de l'Installation**\n\n### V√©rification des Composants\n```bash\n# Liste des composants install√©s\nnode tools/version-functional-release.js --list-components 1.1.0\n```\n\n### V√©rification des Fonctionnalit√©s\n```bash\n# Liste des fonctionnalit√©s actives\nnode tools/version-functional-release.js --list-features 1.1.0\n```\n\n### V√©rification des Drivers\n```bash\n# Nombre de drivers disponibles\nnode tools/version-functional-release.js --count-drivers 1.1.0\n```\n\n## üö® **D√©pannage**\n\n### Probl√®mes Courants\n1. **Erreur de d√©pendances**: `npm install --force`\n2. **Erreur de permissions**: `sudo npm install`\n3. **Erreur de version Node.js**: Mettre √† jour vers Node.js 18+\n4. **Erreur de Git**: V√©rifier les permissions Git\n\n### Logs de Diagnostic\n```bash\n# G√©n√©rer les logs de diagnostic\nnode tools/version-functional-release.js --diagnose 1.1.0\n\n# Analyser les logs\ncat logs/diagnostic-1.1.0.log\n```\n\n## üìû **Support**\n\n### Documentation\n- [Guide d'utilisation](docs/user-guide.md)\n- [API Reference](docs/api-reference.md)\n- [FAQ](docs/faq.md)\n\n### Contact\n- Email: dylan.rajasekaram+homey@gmail.com\n- GitHub: [dlnraja](https://github.com/dlnraja)\n- Issues: [GitHub Issues](https://github.com/dlnraja/tuya_repair/issues)\n\n---\n**Guide g√©n√©r√© automatiquement pour la version 1.1.0**\n",
  "testing_procedures": "# Proc√©dures de Test - Version 1.1.0 (Basic Integration)\n\n## üß™ **Tests Automatis√©s**\n\n### Test de Fonctionnalit√©\n```bash\n# Test complet de la fonctionnalit√©\nnode tools/version-functional-release.js --test-functionality 1.1.0\n\n# Test des composants individuels\nnode tools/intelligent-driver-generator.js --test\nnode tools/legacy-driver-converter.js --test\nnode tools/driver-research-automation.js --test\nnode tools/silent-reference-processor.js --test\nnode tools/comprehensive-silent-processor.js --test\nnode tools/additive-silent-integrator.js --test\n```\n\n### Test de Performance\n```bash\n# Benchmark des performances\nnode tools/version-functional-release.js --benchmark 1.1.0\n\n# Test de charge\nnode tools/version-functional-release.js --stress-test 1.1.0\n```\n\n### Test de Compatibilit√©\n```bash\n# Test de compatibilit√© avec les versions pr√©c√©dentes\nnode tools/version-functional-release.js --compatibility 1.1.0\n\n# Test de migration\nnode tools/version-functional-release.js --migration-test 1.1.0\n```\n\n## üîç **Tests Manuels**\n\n### Test des Composants Fonctionnels\n\n#### Test de intelligent-driver-generator.js\n1. V√©rifier l'existence du fichier\n2. Ex√©cuter le composant avec --test\n3. V√©rifier les logs de sortie\n4. Valider les r√©sultats attendus\n\n\n#### Test de legacy-driver-converter.js\n1. V√©rifier l'existence du fichier\n2. Ex√©cuter le composant avec --test\n3. V√©rifier les logs de sortie\n4. Valider les r√©sultats attendus\n\n\n#### Test de driver-research-automation.js\n1. V√©rifier l'existence du fichier\n2. Ex√©cuter le composant avec --test\n3. V√©rifier les logs de sortie\n4. Valider les r√©sultats attendus\n\n\n#### Test de silent-reference-processor.js\n1. V√©rifier l'existence du fichier\n2. Ex√©cuter le composant avec --test\n3. V√©rifier les logs de sortie\n4. Valider les r√©sultats attendus\n\n\n#### Test de comprehensive-silent-processor.js\n1. V√©rifier l'existence du fichier\n2. Ex√©cuter le composant avec --test\n3. V√©rifier les logs de sortie\n4. Valider les r√©sultats attendus\n\n\n#### Test de additive-silent-integrator.js\n1. V√©rifier l'existence du fichier\n2. Ex√©cuter le composant avec --test\n3. V√©rifier les logs de sortie\n4. Valider les r√©sultats attendus\n\n\n### Test des Fonctionnalit√©s\n\n#### Test de Basic driver generation\n1. Activer la fonctionnalit√©\n2. Ex√©cuter les tests unitaires\n3. V√©rifier l'int√©gration\n4. Valider les performances\n\n\n#### Test de Legacy driver conversion\n1. Activer la fonctionnalit√©\n2. Ex√©cuter les tests unitaires\n3. V√©rifier l'int√©gration\n4. Valider les performances\n\n\n#### Test de Silent integration\n1. Activer la fonctionnalit√©\n2. Ex√©cuter les tests unitaires\n3. V√©rifier l'int√©gration\n4. Valider les performances\n\n\n#### Test de Additive processing\n1. Activer la fonctionnalit√©\n2. Ex√©cuter les tests unitaires\n3. V√©rifier l'int√©gration\n4. Valider les performances\n\n\n#### Test de Research automation\n1. Activer la fonctionnalit√©\n2. Ex√©cuter les tests unitaires\n3. V√©rifier l'int√©gration\n4. Valider les performances\n\n\n#### Test de Reference processing\n1. Activer la fonctionnalit√©\n2. Ex√©cuter les tests unitaires\n3. V√©rifier l'int√©gration\n4. Valider les performances\n\n\n### Test des Drivers\n```bash\n# Test des drivers intelligents\nnode tools/test-intelligent-system.js\n\n# Test des drivers existants\nfind drivers/sdk3 -name \"*.driver.compose.json\" -exec echo \"Testing {}\" ;\n```\n\n## üìä **M√©triques de Test**\n\n### M√©triques de Fonctionnalit√©\n- **Composants test√©s**: 6/6 (100%)\n- **Fonctionnalit√©s test√©es**: 6/6 (100%)\n- **Drivers test√©s**: 148/148 (100%)\n\n### M√©triques de Performance\n- **Temps de r√©ponse**: < 1 seconde\n- **Utilisation m√©moire**: < 100MB\n- **CPU usage**: < 10%\n- **Stabilit√©**: 99.9%\n\n### M√©triques de Qualit√©\n- **Couverture de code**: > 90%\n- **Tests unitaires**: 100%\n- **Tests d'int√©gration**: 100%\n- **Tests de s√©curit√©**: 100%\n\n## üö® **Tests de R√©gression**\n\n### Test de R√©gression depuis 1.2.0\n```bash\n# Comparer avec la version pr√©c√©dente\nnode tools/version-functional-release.js --regression-test 1.2.0 1.1.0\n```\n\n### Test de R√©gression depuis 1.1.0\n```bash\n# Comparer avec la version legacy\nnode tools/version-functional-release.js --regression-test 1.1.0 1.1.0\n```\n\n## üîß **Tests d'Int√©gration**\n\n### Test d'Int√©gration GitHub Actions\n```bash\n# Tester tous les workflows\nfor workflow in .github/workflows/*.yml; do\n  echo \"Testing $workflow\"\n  gh workflow run $(basename $workflow .yml)\ndone\n```\n\n### Test d'Int√©gration des Outils\n```bash\n# Tester tous les outils\nfor tool in tools/*.js; do\n  echo \"Testing $tool\"\n  node $tool --test\ndone\n```\n\n## üìà **Tests de Charge**\n\n### Test de Charge des Drivers\n```bash\n# Test avec 1000 drivers\nnode tools/version-functional-release.js --load-test drivers 1000\n```\n\n### Test de Charge des Workflows\n```bash\n# Test avec 100 ex√©cutions simultan√©es\nnode tools/version-functional-release.js --load-test workflows 100\n```\n\n## üõ°Ô∏è **Tests de S√©curit√©**\n\n### Test de Validation des Entr√©es\n```bash\n# Test avec des entr√©es malveillantes\nnode tools/version-functional-release.js --security-test inputs\n```\n\n### Test de Gestion des Erreurs\n```bash\n# Test avec des erreurs simul√©es\nnode tools/version-functional-release.js --security-test errors\n```\n\n## üìã **Checklist de Test**\n\n### Pr√©-Test\n- [ ] Environnement de test configur√©\n- [ ] Donn√©es de test pr√©par√©es\n- [ ] Outils de test install√©s\n- [ ] Permissions v√©rifi√©es\n\n### Test Principal\n- [ ] Tests unitaires ex√©cut√©s\n- [ ] Tests d'int√©gration ex√©cut√©s\n- [ ] Tests de performance ex√©cut√©s\n- [ ] Tests de s√©curit√© ex√©cut√©s\n\n### Post-Test\n- [ ] R√©sultats analys√©s\n- [ ] Rapports g√©n√©r√©s\n- [ ] Probl√®mes document√©s\n- [ ] Corrections appliqu√©es\n\n## üìä **Rapports de Test**\n\n### G√©n√©ration de Rapports\n```bash\n# G√©n√©rer le rapport complet\nnode tools/version-functional-release.js --generate-report 1.1.0\n\n# G√©n√©rer le rapport de performance\nnode tools/version-functional-release.js --performance-report 1.1.0\n\n# G√©n√©rer le rapport de s√©curit√©\nnode tools/version-functional-release.js --security-report 1.1.0\n```\n\n### Analyse des Rapports\n- **Rapport de fonctionnalit√©**: logs/functionality-report-1.1.0.json\n- **Rapport de performance**: logs/performance-report-1.1.0.json\n- **Rapport de s√©curit√©**: logs/security-report-1.1.0.json\n- **Rapport de compatibilit√©**: logs/compatibility-report-1.1.0.json\n\n---\n**Proc√©dures g√©n√©r√©es automatiquement pour la version 1.1.0**\n"
}